{"functions":["scenario_speed","scenario_fitted_speed"],"note":"Parity vectors generated by analytics/bpr.py. inputs: obs_speed_mph, ff_mph, v, c, alpha, beta, demand_mult, capacity_mult","schema_version":"v1","tags":{"expected":"SIMULATED"},"tolerance_rel":1e-09,"vectors":[{"case":"Manhattan/borough/how139","expected":{"fitted_speed_mph":8.134999165413529,"scenario_fitted_speed_mph":8.134999165413529,"scenario_speed_mph":8.4375},"inputs":{"alpha":1.555228620837717,"beta":0.7834022473075138,"c":24664.525,"capacity_mult":1.0,"demand_mult":1.0,"ff_mph":21.32510757446289,"obs_speed_mph":8.4375,"v":26011.94230769231}},{"case":"Manhattan/borough/how139","expected":{"fitted_speed_mph":8.134999165413529,"scenario_fitted_speed_mph":7.429459149085602,"scenario_speed_mph":7.705724400922324},"inputs":{"alpha":1.555228620837717,"beta":0.7834022473075138,"c":24664.525,"capacity_mult":1.0,"demand_mult":1.2,"ff_mph":21.32510757446289,"obs_speed_mph":8.4375,"v":26011.94230769231}},{"case":"Manhattan/borough/how139","expected":{"fitted_speed_mph":8.134999165413529,"scenario_fitted_speed_mph":9.030878155042426,"scenario_speed_mph":9.366692347939175},"inputs":{"alpha":1.555228620837717,"beta":0.7834022473075138,"c":24664.525,"capacity_mult":1.0,"demand_mult":0.8,"ff_mph":21.32510757446289,"obs_speed_mph":8.4375,"v":26011.94230769231}},{"case":"Manhattan/borough/how139","expected":{"fitted_speed_mph":8.134999165413529,"scenario_fitted_speed_mph":9.030878155042426,"scenario_speed_mph":9.366692347939175},"inputs":{"alpha":1.555228620837717,"beta":0.7834022473075138,"c":24664.525,"capacity_mult":1.25,"demand_mult":1.0,"ff_mph":21.32510757446289,"obs_speed_mph":8.4375,"v":26011.94230769231}},{"case":"Manhattan/borough/how139","expected":{"fitted_speed_mph":8.134999165413529,"scenario_fitted_speed_mph":7.035035354606543,"scenario_speed_mph":7.296633914464003},"inputs":{"alpha":1.555228620837717,"beta":0.7834022473075138,"c":24664.525,"capacity_mult":0.75,"demand_mult":1.0,"ff_mph":21.32510757446289,"obs_speed_mph":8.4375,"v":26011.94230769231}},{"case":"Manhattan/borough/how139","expected":{"fitted_speed_mph":8.134999165413529,"scenario_fitted_speed_mph":5.625588119928699,"scenario_speed_mph":5.834776230058231},"inputs":{"alpha":1.555228620837717,"beta":0.7834022473075138,"c":24664.525,"capacity_mult":1.0,"demand_mult":2.0,"ff_mph":21.32510757446289,"obs_speed_mph":8.4375,"v":26011.94230769231}},{"case":"Manhattan/borough/how139","expected":{"fitted_speed_mph":8.134999165413529,"scenario_fitted_speed_mph":4.411348949833722,"scenario_speed_mph":4.57538544348824},"inputs":{"alpha":1.555228620837717,"beta":0.7834022473075138,"c":24664.525,"capacity_mult":0.5,"demand_mult":1.5,"ff_mph":21.32510757446289,"obs_speed_mph":8.4375,"v":26011.94230769231}},{"case":"Manhattan/borough/how139","expected":{"fitted_speed_mph":8.134999165413529,"scenario_fitted_speed_mph":4.411348949833722,"scenario_speed_mph":4.57538544348824},"inputs":{"alpha":1.555228620837717,"beta":0.7834022473075138,"c":24664.525,"capacity_mult":1.0,"demand_mult":3.0,"ff_mph":21.32510757446289,"obs_speed_mph":8.4375,"v":26011.94230769231}},{"case":"Manhattan/borough/how139","expected":{"fitted_speed_mph":8.134999165413529,"scenario_fitted_speed_mph":8.134999165413529,"scenario_speed_mph":8.4375},"inputs":{"alpha":1.555228620837717,"beta":0.7834022473075138,"c":24664.525,"capacity_mult":1.1,"demand_mult":1.1,"ff_mph":21.32510757446289,"obs_speed_mph":8.4375,"v":26011.94230769231}},{"case":"Manhattan/borough/how71","expected":{"fitted_speed_mph":10.162706135641534,"scenario_fitted_speed_mph":10.162706135641534,"scenario_speed_mph":12.197368621826172},"inputs":{"alpha":1.555228620837717,"beta":0.7834022473075138,"c":24664.525,"capacity_mult":1.0,"demand_mult":1.0,"ff_mph":21.32510757446289,"obs_speed_mph":12.197368621826172,"v":15822.134615384615}},{"case":"Manhattan/borough/how71","expected":{"fitted_speed_mph":10.162706135641534,"scenario_fitted_speed_mph":9.40672304508621,"scenario_speed_mph":11.290031117002357},"inputs":{"alpha":1.555228620837717,"beta":0.7834022473075138,"c":24664.525,"capacity_mult":1.0,"demand_mult":1.2,"ff_mph":21.32510757446289,"obs_speed_mph":12.197368621826172,"v":15822.134615384615}},{"case":"Manhattan/borough/how71","expected":{"fitted_speed_mph":10.162706135641534,"scenario_fitted_speed_mph":11.094070371854892,"scenario_speed_mph":13.315200108701374},"inputs":{"alpha":1.555228620837717,"beta":0.7834022473075138,"c":24664.525,"capacity_mult":1.0,"demand_mult":0.8,"ff_mph":21.32510757446289,"obs_speed_mph":12.197368621826172,"v":15822.134615384615}},{"case":"Manhattan/borough/how71","expected":{"fitted_speed_mph":10.162706135641534,"scenario_fitted_speed_mph":11.094070371854892,"scenario_speed_mph":13.315200108701374},"inputs":{"alpha":1.555228620837717,"beta":0.7834022473075138,"c":24664.525,"capacity_mult":1.25,"demand_mult":1.0,"ff_mph":21.32510757446289,"obs_speed_mph":12.197368621826172,"v":15822.134615384615}},{"case":"Manhattan/borough/how71","expected":{"fitted_speed_mph":10.162706135641534,"scenario_fitted_speed_mph":8.975128380093425,"scenario_speed_mph":10.772027432366812},"inputs":{"alpha":1.555228620837717,"beta":0.7834022473075138,"c":24664.525,"capacity_mult":0.75,"demand_mult":1.0,"ff_mph":21.32510757446289,"obs_speed_mph":12.197368621826172,"v":15822.134615384615}},{"case":"Manhattan/borough/how71","expected":{"fitted_speed_mph":10.162706135641534,"scenario_fitted_speed_mph":7.377662846664005,"scenario_speed_mph":8.854735353678675},"inputs":{"alpha":1.555228620837717,"beta":0.7834022473075138,"c":24664.525,"capacity_mult":1.0,"demand_mult":2.0,"ff_mph":21.32510757446289,"obs_speed_mph":12.197368621826172,"v":15822.134615384615}},{"case":"Manhattan/borough/how71","expected":{"fitted_speed_mph":10.162706135641534,"scenario_fitted_speed_mph":5.928047467549448,"scenario_speed_mph":7.11489432089333},"inputs":{"alpha":1.555228620837717,"beta":0.7834022473075138,"c":24664.525,"capacity_mult":0.5,"demand_mult":1.5,"ff_mph":21.32510757446289,"obs_speed_mph":12.197368621826172,"v":15822.134615384615}},{"case":"Manhattan/borough/how71","expected":{"fitted_speed_mph":10.162706135641534,"scenario_fitted_speed_mph":5.928047467549448,"scenario_speed_mph":7.11489432089333},"inputs":{"alpha":1.555228620837717,"beta":0.7834022473075138,"c":24664.525,"capacity_mult":1.0,"demand_mult":3.0,"ff_mph":21.32510757446289,"obs_speed_mph":12.197368621826172,"v":15822.134615384615}},{"case":"Manhattan/borough/how71","expected":{"fitted_speed_mph":10.162706135641534,"scenario_fitted_speed_mph":10.162706135641535,"scenario_speed_mph":12.197368621826175},"inputs":{"alpha":1.555228620837717,"beta":0.7834022473075138,"c":24664.525,"capacity_mult":1.1,"demand_mult":1.1,"ff_mph":21.32510757446289,"obs_speed_mph":12.197368621826172,"v":15822.134615384615}},{"case":"Manhattan/borough/how27","expected":{"fitted_speed_mph":17.81824405407473,"scenario_fitted_speed_mph":17.81824405407473,"scenario_speed_mph":17.97834587097168},"inputs":{"alpha":1.555228620837717,"beta":0.7834022473075138,"c":24664.525,"capacity_mult":1.0,"demand_mult":1.0,"ff_mph":21.32510757446289,"obs_speed_mph":17.97834587097168,"v":1762.4716981132076}},{"case":"Manhattan/borough/how27","expected":{"fitted_speed_mph":17.81824405407473,"scenario_fitted_speed_mph":17.37943990313405,"scenario_speed_mph":17.535598944210086},"inputs":{"alpha":1.555228620837717,"beta":0.7834022473075138,"c":24664.525,"capacity_mult":1.0,"demand_mult":1.2,"ff_mph":21.32510757446289,"obs_speed_mph":17.97834587097168,"v":1762.4716981132076}},{"case":"Manhattan/borough/how27","expected":{"fitted_speed_mph":17.81824405407473,"scenario_fitted_speed_mph":18.300928143960487,"scenario_speed_mph":18.46536700998211},"inputs":{"alpha":1.555228620837717,"beta":0.7834022473075138,"c":24664.525,"capacity_mult":1.0,"demand_mult":0.8,"ff_mph":21.32510757446289,"obs_speed_mph":17.97834587097168,"v":1762.4716981132076}},{"case":"Manhattan/borough/how27","expected":{"fitted_speed_mph":17.81824405407473,"scenario_fitted_speed_mph":18.300928143960487,"scenario_speed_mph":18.46536700998211},"inputs":{"alpha":1.555228620837717,"beta":0.7834022473075138,"c":24664.525,"capacity_mult":1.25,"demand_mult":1.0,"ff_mph":21.32510757446289,"obs_speed_mph":17.97834587097168,"v":1762.4716981132076}},{"case":"Manhattan/borough/how27","expected":{"fitted_speed_mph":17.81824405407473,"scenario_fitted_speed_mph":17.107097763094302,"scenario_speed_mph":17.260809735238876},"inputs":{"alpha":1.555228620837717,"beta":0.7834022473075138,"c":24664.525,"capacity_mult":0.75,"demand_mult":1.0,"ff_mph":21.32510757446289,"obs_speed_mph":17.97834587097168,"v":1762.4716981132076}},{"case":"Manhattan/borough/how27","expected":{"fitted_speed_mph":17.81824405407473,"scenario_fitted_speed_mph":15.929097916747954,"scenario_speed_mph":16.072225236716253},"inputs":{"alpha":1.555228620837717,"beta":0.7834022473075138,"c":24664.525,"capacity_mult":1.0,"demand_mult":2.0,"ff_mph":21.32510757446289,"obs_speed_mph":17.97834587097168,"v":1762.4716981132076}},{"case":"Manhattan/borough/how27","expected":{"fitted_speed_mph":17.81824405407473,"scenario_fitted_speed_mph":14.552356116396753,"scenario_speed_mph":14.683113033144325},"inputs":{"alpha":1.555228620837717,"beta":0.7834022473075138,"c":24664.525,"capacity_mult":0.5,"demand_mult":1.5,"ff_mph":21.32510757446289,"obs_speed_mph":17.97834587097168,"v":1762.4716981132076}},{"case":"Manhattan/borough/how27","expected":{"fitted_speed_mph":17.81824405407473,"scenario_fitted_speed_mph":14.552356116396753,"scenario_speed_mph":14.683113033144325},"inputs":{"alpha":1.555228620837717,"beta":0.7834022473075138,"c":24664.525,"capacity_mult":1.0,"demand_mult":3.0,"ff_mph":21.32510757446289,"obs_speed_mph":17.97834587097168,"v":1762.4716981132076}},{"case":"Manhattan/borough/how27","expected":{"fitted_speed_mph":17.81824405407473,"scenario_fitted_speed_mph":17.81824405407473,"scenario_speed_mph":17.97834587097168},"inputs":{"alpha":1.555228620837717,"beta":